<Question xmlns:html="http://www.w3.org/TR/REC-html40" xmlns:xsi="http://www.w3.org/2001/XMLSchema-instance" xsi:schemaLocation="http://eds.com/questionxhtml ..\Question.xsd">
	<Id>488</Id>
	<Label>Third party address 5</Label>
	<ObjectName>ThirdPartyAddress5</ObjectName>
	<Html>	
		<input type="text" id="ThirdPartyAddress5" size="50"></input>
	</Html>			
	<Javascript>
		<XPath>/ds/EnterVariableData/ThirdPartyDebt/ThirdParty/Address/Line[5]</XPath>
		<componentName>##label##</componentName>
		<isMandatory>return false;</isMandatory>
		<HintText>Fifth line of Third party/address</HintText>			
	</Javascript>
</Question>