<?xml version="1.0" encoding="UTF-8"?>
<Question xmlns:html="http://www.w3.org/TR/REC-html40" xmlns:xsi="http://www.w3.org/2001/XMLSchema-instance" xsi:schemaLocation="http://eds.com/questionxhtml ..\Question.xsd">
	<Id>425</Id>
	<Label>Anything else be brought to the hearing?</Label>
	<ObjectName>BroughtToHearing</ObjectName>
	<Html>
		<input type="checkbox" id="BroughtToHearing"></input>
	</Html>
	
	<Javascript>
		<XPath>/ds/EnterVariableData/SmallTrack/broughtToHearing</XPath>
		<HintText>Check box if anything else is to be brought to the hearing</HintText>
		<modelValue>checked: "Y", unchecked: "N"</modelValue>
		<enableOn>DirectionsTypeReqd.dataBinding, IsSpecialDirns.dataBinding, IsInspectDirns.dataBinding, UOInspectDirns.dataBinding, UODetails2.dataBinding</enableOn>
		<isEnabled>
			var val1 = Services.getValue(IsSpecialDirns.dataBinding);
			var val2 = Services.getValue(IsInspectDirns.dataBinding);
			var val3 = Services.getValue(UOInspectDirns.dataBinding);

			return('Y' == val1 || ( IsInspectDirns.isEnabled() &amp;&amp; 'Y' != val2 ) || (UOInspectDirns.isEnabled() &amp;&amp; 'Y' != val3 ) || UODetails2.isEnabled());
		</isEnabled>
		<logicOn>DirectionsTypeReqd.dataBinding, IsSpecialDirns.dataBinding, IsInspectDirns.dataBinding, UOInspectDirns.dataBinding, UODetails2.dataBinding</logicOn>
		<logic>
			var val1 = Services.getValue(IsSpecialDirns.dataBinding);
			var val2 = Services.getValue(IsInspectDirns.dataBinding);
			var val3 = Services.getValue(UOInspectDirns.dataBinding);
			if('Y' != val1 &amp;&amp; ( !IsInspectDirns.isEnabled() || 'Y' == val2 ) &amp;&amp; (!UOInspectDirns.isEnabled() || 'Y' == val3 )&amp;&amp; !UODetails2.isEnabled())
			{	Services.setValue(BroughtToHearing.dataBinding, "N");
			}
		</logic>
		<initialise>Services.setValue(BroughtToHearing.dataBinding, "N");</initialise>
	</Javascript>
</Question>