<?xml version="1.0" encoding="UTF-8"?>
<Question xmlns:html="http://www.w3.org/TR/REC-html40" xmlns:xsi="http://www.w3.org/2001/XMLSchema-instance" xsi:schemaLocation="http://eds.com/questionxhtml ..\Question.xsd">
	<Id>192</Id>
	<Label>Is limited disclosure ordered</Label>
	<ObjectName>IsLimitedDisclosure</ObjectName>
	<Html>	
		<input type="checkbox" id="IsLimitedDisclosure"></input>
	</Html>
	<Javascript>
		<XPath>/ds/EnterVariableData/FastTrack/isLimitedDisclosure</XPath>
		<HintText>Check box if limited disclosure is ordered</HintText>		
		<modelValue>checked: "Y", unchecked: "N"</modelValue>
		<enableOn>IsDisclosureOrdered.dataBinding</enableOn>
		<isEnabled>return('Y' == Services.getValue(IsDisclosureOrdered.dataBinding));</isEnabled>
		<logicOn>IsDisclosureOrdered.dataBinding</logicOn>
		<logic>
			if('Y' != Services.getValue(IsDisclosureOrdered.dataBinding))
			{	Services.setValue(IsLimitedDisclosure.dataBinding, "N");
			}
		</logic>
	</Javascript>
</Question>