<?xml version="1.0" encoding="UTF-8"?>
<Question xmlns:html="http://www.w3.org/TR/REC-html40" xmlns:xsi="http://www.w3.org/2001/XMLSchema-instance" xsi:schemaLocation="http://eds.com/questionxhtml ..\Question.xsd">
	<Id>452</Id>
	<Label>Other suspension details</Label>
	<ObjectName>OtherSuspDtls</ObjectName>
	<Html>			
		<input type="text" id="OtherSuspDtls"></input>		
	</Html>			
	<Javascript>
		<XPath>/ds/EnterVariableData/DisobedienceCommit/otherSuspDtls</XPath>
		<componentName>##label##</componentName>
		<isMandatory>return false;</isMandatory>
		<HintText>Enter any other suspension details ordered at N79A</HintText>			
	</Javascript>
</Question>