<?xml version="1.0" encoding="UTF-8"?>
<Question xmlns:html="http://www.w3.org/TR/REC-html40" xmlns:xsi="http://www.w3.org/2001/XMLSchema-instance" xsi:schemaLocation="http://eds.com/questionxhtml ..\Question.xsd">
	<Id>806</Id>
	<Label>Maximum fine</Label>
	<ObjectName>MaximumFine</ObjectName>
	<Html>
	  <input id="DefaultCurrency806" type="text" size="1">
	  </input> <input id="MaximumFine" type="text" size="10"></input>
	</Html>
	<Javascript>
		<XPath>/ds/EnterVariableData/MaximumFine</XPath>
		<componentName>##label##</componentName>
		<HintText>Enter the maximum amount the debtor can be fined</HintText>
		<isMandatory>return true;</isMandatory>
		<mandatoryOn>MaximumFine.dataBinding</mandatoryOn>
		<validateOn>MaximumFine.dataBinding</validateOn>
		<validate>
			var val = Services.getValue(MaximumFine.dataBinding);
			var err = null;
			var maxVal = 999999.99;
			
			
			if('0.00' != val)
			{
				err = validateCurrencyValue(val, maxVal);
				if( null == err )
				{ 	
					var fVal = WPU.formatToTwoDP(val);
					Services.setValue(MaximumFine.dataBinding, fVal);
				}
			}
			return err;
		</validate>
		<miscCode>
			function DefaultCurrency806() {}
			DefaultCurrency806.dataBinding = "/ds/EnterVariableData/curr1";
			DefaultCurrency806.tabIndex = -1;
			DefaultCurrency806.maxLength = 1;
			DefaultCurrency806.isReadOnly = function(){return true;}
			DefaultCurrency806.isTemporary = function(){return true;}
			DefaultCurrency806.transformToDisplay = function(value){
				return WPS.__CaseManUtils().transformCurrencySymbolToDisplay(value,null,null); }
			DefaultCurrency806.transformToModel = function(value){
				return WPS.__CaseManUtils().transformCurrencySymbolToModel(value,null,null); }
		</miscCode>
	</Javascript>
</Question>

