<Question xmlns:html="http://www.w3.org/TR/REC-html40" xmlns:xsi="http://www.w3.org/2001/XMLSchema-instance" xsi:schemaLocation="http://eds.com/questionxhtml ..\Question.xsd">
	<Id>557</Id>
	<Label>Amount of surety sum 1, if applicable</Label>
	<ObjectName>SuretySum1</ObjectName>
	<Html>	
		<input type="text" id="DefaultCurrency557" size="1"></input>
		<input type="text" id="SuretySum1"  size="11" maxlength="11"></input>
	</Html>			
	<Javascript>
		<XPath>/ds/EnterVariableData/Remand/suretySum1</XPath>
		<componentName>##label##</componentName>
		<isMandatory>return true;</isMandatory>
		<HintText>Enter the amount of the surety sum</HintText>
		<maxLength>11</maxLength>		
		<enableOn>BailConditionsSet.dataBinding</enableOn>
		<isEnabled>return( 'Y' == Services.getValue(BailConditionsSet.dataBinding));</isEnabled>
		<logicOn>BailConditionsSet.dataBinding</logicOn>
		<logic>
			if( 'Y' != Services.getValue(BailConditionsSet.dataBinding))
			{	Services.setValue(SuretySum1.dataBinding, "");
			}
		</logic>			
		<validateOn>SuretySum1.dataBinding</validateOn>
		<validate>
			var val = Services.getValue(SuretySum1.dataBinding);
			var err = validateCurrencyValue(val, 99999999.99);
			if( null == err )
			{	Services.setValue(SuretySum1.dataBinding, WPU.formatToTwoDP(val));
			}
			return err;
		</validate>
		<miscCode>
			function DefaultCurrency557() {}
			DefaultCurrency557.dataBinding = "/ds/EnterVariableData/curr1";
			DefaultCurrency557.tabIndex = -1;
			DefaultCurrency557.maxLength = 1;
			DefaultCurrency557.isReadOnly = function(){return true;}
			DefaultCurrency557.isTemporary = function(){return true;}
			DefaultCurrency557.transformToDisplay = function(value){
				return WPS.__CaseManUtils().transformCurrencySymbolToDisplay(value,null,null); }
			DefaultCurrency557.transformToModel = function(value){
				return WPS.__CaseManUtils().transformCurrencySymbolToModel(value,null,null); }
		</miscCode>
	</Javascript>
</Question>